ID,Submission ID,User,Quiz,Score,Total Questions,Percentage,Submitted At,Answers JSON
51ff6199-eea3-4ffa-8baa-44854d0d0140,1,,,598,598,59.8,2025-05-22T14:45:45.477Z,Cubicularis spes delectatio coaegresco collum suus ea. At tolero eum aspicio capitulus color deporto. Viriliter deprimo campana depraedor vos.
82c076cb-3ada-4d8f-a8ad-77ea7d6cebe3,2,,,306,306,30.5,2024-03-21T13:50:24.388Z,Perferendis tolero paulatim succedo adhuc. Cicuta reiciendis demens ustilo recusandae. Tunc cras bellicus ventus vinco.
2d3ccde1-6cc0-4ec8-a3d9-c94d5c9b0fba,3,,,343,343,34.2,2024-05-15T00:40:30.414Z,Artificiose reiciendis aestas possimus suppono. Vito tam amplexus valde vilitas commodi desidero trans. Vigor strues surgo tenetur desipio dedico.
fb3014d5-155c-4864-8ba1-8f60d8afd3ca,4,,BG CH 2 Verse 13,1,1,100,2026-04-17T09:30:38.991Z,"[{""questionId"":""9gnktu9k"",""selected"":[0]}]"
44cfc903-34f2-496f-afee-73360594cdee,5,Sahil Negi,Science of Self Realization,5,5,100,2026-05-13T13:52:10.145Z,"[{""questionId"":""fax5io4i"",""selected"":[2]},{""questionId"":""7m962xd5"",""selected"":[2]},{""questionId"":""mxsdfp0z"",""selected"":[3,1,0]},{""questionId"":""gzm9tfkt"",""selected"":[0,2,3]},{""questionId"":""scgv8jx5"",""selected"":[2]}]"
b0eec19b-c985-498b-9d05-ff15becf103d,6,Durga Prasad Jakka,Bangalore yatra,0,1,0,2026-05-14T06:39:07.107Z,"[{""questionId"":""19tpxk9d"",""selected"":[1]}]"
48116421-b28f-4bd1-92f3-aeec7be36ce9,7,Durga Prasad Jakka,Science of Self Realization,5,5,100,2026-05-14T06:46:32.018Z,"[{""questionId"":""fax5io4i"",""selected"":[2]},{""questionId"":""7m962xd5"",""selected"":[2]},{""questionId"":""mxsdfp0z"",""selected"":[0,1,3]},{""questionId"":""gzm9tfkt"",""selected"":[0,2,3]},{""questionId"":""scgv8jx5"",""selected"":[2]}]"
bbf17f48-f015-47b2-8185-fddee22c6f2d,8,Sunny Khobragade,Science of Self Realization,5,5,100,2026-05-14T07:56:16.382Z,"[{""questionId"":""fax5io4i"",""selected"":[2]},{""questionId"":""7m962xd5"",""selected"":[2]},{""questionId"":""mxsdfp0z"",""selected"":[0,1,3]},{""questionId"":""gzm9tfkt"",""selected"":[0,2,3]},{""questionId"":""scgv8jx5"",""selected"":[2]}]"